{
  "trip_name": "巴黎 3 天经典行程",
  "destination": "Paris",
  "country": "France",
  "origin": "Shanghai (PVG)",
  "date_range": "2026-10-01 ~ 2026-10-03",
  "party_size": 2,
  "currency": "EUR",
  "summary": "3 天覆盖卢浮宫、埃菲尔铁塔、蒙马特与塞纳河，住 1 区便于步行，航班与酒店提供比价链接自行核价。",
  "assumptions": [
    "航班与酒店价格随查询时间浮动，本行程仅提供查询链接，未锁定实时价",
    "假设持申根签证，签证需在出行前确认有效"
  ],
  "flights": [
    {
      "leg": "outbound", "origin": "PVG", "dest": "CDG", "date": "2026-10-01",
      "status": "not_booked",
      "links": [
        {"provider": "Google Flights", "url": "https://www.google.com/travel/flights?q=flights+from+PVG+to+CDG+on+2026-10-01"},
        {"provider": "Skyscanner", "url": "https://www.skyscanner.net/transport/flights/pvg/cdg/261001/?adults=2"}
      ],
      "note": "直飞约 12–13 小时，建议选早班以便当天下午抵达"
    },
    {
      "leg": "return", "origin": "CDG", "dest": "PVG", "date": "2026-10-03",
      "status": "not_booked",
      "links": [
        {"provider": "Google Flights", "url": "https://www.google.com/travel/flights?q=flights+from+CDG+to+PVG+on+2026-10-03"}
      ]
    }
  ],
  "hotel": {
    "name": "Hotel du Louvre area (示例)",
    "address": "1st arrondissement, Paris",
    "why": "位于 1 区，步行可达卢浮宫与塞纳河，地铁换乘方便",
    "lng": 2.3360, "lat": 48.8629,
    "booking_links": [
      {"provider": "Booking.com", "url": "https://www.booking.com/searchresults.html?ss=Paris&checkin=2026-10-01&checkout=2026-10-03&group_adults=2"},
      {"provider": "Google Hotels", "url": "https://www.google.com/travel/hotels/Paris?ss=Paris"}
    ]
  },
  "days": [
    {
      "day": 1, "date": "2026-10-01", "region": "1区-卢浮宫", "theme": "抵达+市中心",
      "weather": "多云 18°C",
      "center": [2.3376, 48.8606],
      "pois": [
        {"idx": 1, "name": "Louvre Museum", "time": "14:00", "duration_min": 180, "lng": 2.3376, "lat": 48.8606, "requires_booking": true,
         "price": {"min": 22, "currency": "EUR", "unit": "人", "source": "official-site", "source_ref": "https://www.louvre.fr", "checked_at": "2026-09-14"},
         "map_links": [{"provider": "Google Maps", "url": "https://www.google.com/maps/search/?api=1&query=48.8606,2.3376"}]},
        {"idx": 2, "name": "Jardin des Tuileries", "time": "17:30", "duration_min": 60, "lng": 2.3267, "lat": 48.8635, "next_mode": "walk"},
        {"idx": 3, "name": "Seine River evening walk", "time": "19:00", "duration_min": 90, "lng": 2.3407, "lat": 48.8570, "weather_sensitive": true, "indoor_backup": "改去附近咖啡馆"}
      ],
      "transports": [
        {"from_idx": 0, "to_idx": 1, "mode": "walk", "duration_min": 8, "source": "google-maps"},
        {"from_idx": 1, "to_idx": 2, "mode": "walk", "duration_min": 10, "source": "google-maps"},
        {"from_idx": 2, "to_idx": 3, "mode": "walk", "duration_min": 12, "source": "google-maps"}
      ],
      "plan_b": {"trigger": "下雨", "alternative": "延长卢浮宫室内时间，取消塞纳河散步", "impact": "行程缩短约 1.5 小时"}
    },
    {
      "day": 2, "date": "2026-10-02", "region": "7区-铁塔", "theme": "地标",
      "weather": "晴 20°C",
      "center": [2.2945, 48.8584],
      "pois": [
        {"idx": 1, "name": "Eiffel Tower", "time": "09:30", "duration_min": 150, "lng": 2.2945, "lat": 48.8584, "requires_booking": true,
         "price": {"min": 29, "currency": "EUR", "unit": "人", "source": "official-site", "source_ref": "https://www.toureiffel.paris", "checked_at": "2026-09-14"}},
        {"idx": 2, "name": "Champ de Mars", "time": "12:00", "duration_min": 45, "lng": 2.2980, "lat": 48.8556, "next_mode": "transit"},
        {"idx": 3, "name": "Musée d'Orsay", "time": "14:30", "duration_min": 150, "lng": 2.3266, "lat": 48.8600}
      ],
      "transports": [
        {"from_idx": 0, "to_idx": 1, "mode": "transit", "duration_min": 20, "source": "google-maps"},
        {"from_idx": 1, "to_idx": 2, "mode": "walk", "duration_min": 8, "source": "google-maps"},
        {"from_idx": 2, "to_idx": 3, "mode": "transit", "duration_min": 18, "source": "google-maps"}
      ]
    },
    {
      "day": 3, "date": "2026-10-03", "region": "18区-蒙马特", "theme": "蒙马特+返程", "region_flex": true,
      "weather": "多云 19°C",
      "center": [2.3431, 48.8867],
      "pois": [
        {"idx": 1, "name": "Sacré-Cœur", "time": "09:00", "duration_min": 90, "lng": 2.3431, "lat": 48.8867},
        {"idx": 2, "name": "Place du Tertre", "time": "10:45", "duration_min": 60, "lng": 2.3406, "lat": 48.8865, "next_mode": "transit"},
        {"idx": 3, "name": "CDG Airport", "time": "14:00", "duration_min": 30, "lng": 2.5479, "lat": 49.0097}
      ],
      "transports": [
        {"from_idx": 0, "to_idx": 1, "mode": "transit", "duration_min": 25, "source": "google-maps"},
        {"from_idx": 1, "to_idx": 2, "mode": "walk", "duration_min": 5, "source": "google-maps"},
        {"from_idx": 2, "to_idx": 3, "mode": "transit", "duration_min": 70, "source": "google-maps"}
      ],
      "plan_b": {"trigger": "地铁延误", "alternative": "改乘 RER B 或打车去 CDG", "impact": "多花 30–40 分钟与打车费"}
    }
  ],
  "prebook": [
    {"item": "Louvre 门票", "day": 1, "deadline": "出行前 2-3 天", "priority": "must", "status": "not_booked", "id_required": false, "url": "https://www.louvre.fr", "channel": "official"},
    {"item": "Eiffel Tower 登顶票", "day": 2, "deadline": "出行前 1-2 周（旺季更早）", "priority": "must", "status": "not_booked", "id_required": false, "url": "https://www.toureiffel.paris", "channel": "official"}
  ],
  "source_coverage": [
    {"platform": "discovery", "status": "used", "stages": ["discovery"], "purpose": "网络攻略确认经典分区与节奏", "checked_at": "2026-09-14", "source_refs": ["https://www.google.com/search?q=paris+3+days+itinerary"]},
    {"platform": "official", "status": "used", "stages": ["constraints"], "purpose": "官方站确认开放时间与票价", "checked_at": "2026-09-14", "source_refs": ["https://www.louvre.fr", "https://www.toureiffel.paris"]},
    {"platform": "maps", "status": "used", "stages": ["spatial"], "purpose": "地图确认坐标与通勤时长", "checked_at": "2026-09-14", "source_refs": ["https://www.google.com/maps"]},
    {"platform": "dining", "status": "degraded", "stages": ["dining"], "purpose": "餐厅未逐一落位，提供区域搜索链接", "checked_at": "2026-09-14", "source_refs": ["https://www.google.com/maps/search/?api=1&query=restaurants+near+Louvre"], "note": "本示例未固定餐厅，交付时按当日区域补"},
    {"platform": "booking", "status": "degraded", "stages": ["booking", "pricing"], "purpose": "航班酒店降级为查询链接，未锁实时价", "checked_at": "2026-09-14", "source_refs": ["https://www.booking.com", "https://www.google.com/travel/flights"], "note": "无免费官方 API，实时价请点开链接核对"}
  ],
  "safety_notes": [
    {"risk": "地铁与地标周边扒手多", "action": "背包前背，证件与手机分开放", "severity": "warning", "applies_to": "全程", "source": "official", "source_ref": "https://cn.ambafrance.org", "checked_at": "2026-09-14"},
    {"risk": "末日赶 CDG 航班", "action": "预留 ≥3 小时到机场（含值机+安检+退税）", "severity": "critical", "day": 3, "source": "official", "source_ref": "https://www.parisaeroport.fr", "checked_at": "2026-09-14"}
  ],
  "rechecks": [
    {"item": "Louvre/Eiffel 开放与票价", "category": "opening", "status": "verified", "checked_at": "2026-09-14", "recheck_at": "2026-09-28", "source": "official-site", "source_ref": "https://www.louvre.fr"},
    {"item": "航班价格与时刻", "category": "price", "status": "verified", "checked_at": "2026-09-14", "recheck_at": "2026-09-24", "source": "google-flights", "source_ref": "https://www.google.com/travel/flights"}
  ],
  "budget_summary": {"total_min": 1200, "total_max": 2000, "currency": "EUR", "note": "不含大交通机票，机票请另按链接核价"}
}
